{
  "run_id": "pullback_mr_jul2026",
  "title": "Pullback MR Jul 2026",
  "created_at": "2026-07-27T16:59:46.951239+00:00",
  "root": "runs/pullback_mr_jul2026",
  "status": "psa_complete",
  "numeric_id": null,
  "source": "cursor_agent",
  "symbol": null,
  "oos_start_ts": "2025-01-01",
  "workflow": "single_asset_signals",
  "strategy_type": "MEAN_REVERSION",
  "last_scope": null,
  "strategy_spec_path": "strategy_spec.json",
  "artifacts": {
    "metrics": {
      "path": "runs/pullback_mr_jul2026/artifacts/metrics.json",
      "format": "json"
    },
    "qqq_norm_ibs_rsi_drawdown": {
      "path": "runs/pullback_mr_jul2026/charts/qqq_norm_ibs_rsi_drawdown.png",
      "format": "png"
    },
    "qqq_norm_ibs_rsi_equity_curve": {
      "path": "runs/pullback_mr_jul2026/charts/qqq_norm_ibs_rsi_equity_curve.png",
      "format": "png"
    },
    "spy_rsi_drop_drawdown": {
      "path": "runs/pullback_mr_jul2026/charts/spy_rsi_drop_drawdown.png",
      "format": "png"
    },
    "spy_rsi_drop_equity_curve": {
      "path": "runs/pullback_mr_jul2026/charts/spy_rsi_drop_equity_curve.png",
      "format": "png"
    },
    "strategy_spec": {
      "path": "runs/pullback_mr_jul2026/strategy_spec.json",
      "format": "json"
    },
    "report": {
      "path": "runs/pullback_mr_jul2026/report.md",
      "format": "md"
    },
    "ibs_btcusdt_equity": {
      "path": "runs/pullback_mr_jul2026/charts/ibs_btcusdt_equity.png",
      "format": "png"
    },
    "ibs_cross_asset_equity": {
      "path": "runs/pullback_mr_jul2026/charts/ibs_cross_asset_equity.png",
      "format": "png"
    },
    "ibs_ethusdt_equity": {
      "path": "runs/pullback_mr_jul2026/charts/ibs_ethusdt_equity.png",
      "format": "png"
    },
    "ibs_gld_equity": {
      "path": "runs/pullback_mr_jul2026/charts/ibs_gld_equity.png",
      "format": "png"
    },
    "ibs_iwm_equity": {
      "path": "runs/pullback_mr_jul2026/charts/ibs_iwm_equity.png",
      "format": "png"
    },
    "ibs_qqq_equity": {
      "path": "runs/pullback_mr_jul2026/charts/ibs_qqq_equity.png",
      "format": "png"
    },
    "ibs_spy_equity": {
      "path": "runs/pullback_mr_jul2026/charts/ibs_spy_equity.png",
      "format": "png"
    },
    "psa_ibs_btcusdt_heatmap": {
      "path": "runs/pullback_mr_jul2026/charts/psa_ibs_btcusdt_heatmap.png",
      "format": "png"
    },
    "psa_ibs_ethusdt_heatmap": {
      "path": "runs/pullback_mr_jul2026/charts/psa_ibs_ethusdt_heatmap.png",
      "format": "png"
    },
    "psa_ibs_gld_heatmap": {
      "path": "runs/pullback_mr_jul2026/charts/psa_ibs_gld_heatmap.png",
      "format": "png"
    },
    "psa_ibs_heatmap": {
      "path": "runs/pullback_mr_jul2026/charts/psa_ibs_heatmap.png",
      "format": "png"
    },
    "psa_ibs_iwm_heatmap": {
      "path": "runs/pullback_mr_jul2026/charts/psa_ibs_iwm_heatmap.png",
      "format": "png"
    },
    "psa_ibs_qqq_heatmap": {
      "path": "runs/pullback_mr_jul2026/charts/psa_ibs_qqq_heatmap.png",
      "format": "png"
    },
    "psa_ibs_spy_heatmap": {
      "path": "runs/pullback_mr_jul2026/charts/psa_ibs_spy_heatmap.png",
      "format": "png"
    }
  },
  "completed_steps": [
    "baseline",
    "robustness",
    "psa"
  ],
  "defaults": {
    "oos_start": "2025-01-01",
    "fee": 0.00045,
    "slippage": 0.0005,
    "interval": "1d"
  },
  "validation_passed": true,
  "last_validation_at": "2026-07-27T19:46:55.093034+00:00",
  "last_execution_at": "2026-07-27T19:46:55.093034+00:00",
  "last_error": null
}
