{
  "run_id": "demo_btc_mr",
  "title": "BTC mean reversion",
  "created_at": "2026-07-13T18:00:00+00:00",
  "root": "runs/demo_btc_mr",
  "status": "baseline_complete",
  "numeric_id": 1,
  "source": "demo_script",
  "symbol": "BTCUSDT",
  "oos_start_ts": "2025-01-01",
  "workflow": "single_asset_signals",
  "strategy_type": "MEAN_REVERSION",
  "last_scope": null,
  "strategy_spec_path": "strategy_spec.json",
  "artifacts": {
    "metrics": {
      "path": "runs/demo_btc_mr/artifacts/metrics.json",
      "format": "json"
    },
    "drawdown": {
      "path": "runs/demo_btc_mr/charts/drawdown.png",
      "format": "png"
    },
    "equity_curve": {
      "path": "runs/demo_btc_mr/charts/equity_curve.png",
      "format": "png"
    },
    "strategy_spec": {
      "path": "runs/demo_btc_mr/strategy_spec.json",
      "format": "json"
    },
    "report": {
      "path": "runs/demo_btc_mr/report.md",
      "format": "md"
    }
  },
  "completed_steps": [
    "baseline"
  ],
  "defaults": {
    "oos_start": "2025-01-01",
    "fee": 0.00045,
    "slippage": 0.0005,
    "interval": "1d"
  },
  "validation_passed": true,
  "last_validation_at": "2026-07-15T10:45:04.970159+00:00",
  "last_execution_at": "2026-07-15T10:45:04.850921+00:00",
  "last_error": null,
  "verdict": "no_edge",
  "tags": [
    "btc",
    "negative_result"
  ],
  "related_runs": [],
  "hypothesis": "BTC z-score MR",
  "kill_reason": "weak OOS Sharpe"
}
