{
  "run_id": "6",
  "title": "btc-hf-lowcorr-ensemble-jul2026",
  "created_at": "2026-07-30T21:50:16.489095+00:00",
  "root": "runs/6",
  "status": "created",
  "numeric_id": 6,
  "source": "cursor_agent",
  "symbol": null,
  "oos_start_ts": "2025-01-01",
  "workflow": null,
  "strategy_type": null,
  "last_scope": null,
  "strategy_spec_path": "strategy_spec.json",
  "artifacts": {},
  "completed_steps": [],
  "defaults": {
    "oos_start": "2025-01-01",
    "fee": 0.00045,
    "slippage": 0.0005,
    "interval": "1d"
  },
  "validation_passed": false,
  "last_validation_at": null,
  "last_execution_at": null,
  "last_error": null
}
